user_input,retrieved_contexts,response,reference,faithfulness,answer_relevancy,context_precision,context_recall
How can artificial minds differ from human minds?,"['Other properties of possible artificial minds would be exotic in a more superficial sense;\ne.g., by diverging in some unproblematically quantitative dimension from the kinds of\nmind with which we are familiar. But such superficially exotic properties may also pose\n11', 'relevant insofar as it makes a diﬀerence to sentience or functionality. But holding these\nthings constant, it makes no moral diﬀerence whether a being is made of silicon or car-\nbon, or whether its brain uses semi-conductors or neurotransmitters.\nAn additional principle that can be proposed is that the fact that AI systems are\nartificial—i.e., the product of deliberate design—is not fundamentally relevant to their\nmoral status. We could formulate this as follows:', 'scious experience to any individual who exhibits the normal kinds of human behavior.\nFew believe there to be other people who act perfectly normally but lack consciousness.\nHowever, other human beings do not merely behave in person-like ways similar to our-\nselves; they also have brains and cognitive architectures that are constituted much like\nour own. An artificial intellect, by contrast, might be constituted quite diﬀerently from', 'duties to their artificial mind which they do not have to another artificial mind, even if\nthe minds in question are qualitatively similar and have the same moral status.\nIf the principles of non-discrimination with regard to substrate and ontogeny are\naccepted, then many questions about how we ought to treat artificial minds can be an-\nswered by applying the same moral principles that we use to determine our duties in\n8', 'a human intellect yet still exhibit human-like behavior or possess the behavioral dispo-\nsitions normally indicative of personhood. Itmight therefore be possible to conceive of\nan artificial intellect that would be sapient, and perhaps would be a person, yet would\nnot be sentient or have conscious experiences of any kind. (Whether this is really pos-\nsible depends on the answers to some non-trivial metaphysical questions.) Should such']","According to the given context, artificial minds can differ from human minds in the following ways:

1. Constitution: Artificial intellects might be constituted quite differently from human intellects.
2. Substrate: Artificial minds can be made of different materials, such as silicon, rather than carbon.
3. Brain function: Artificial minds can use semi-conductors instead of neurotransmitters.
4. Cognitive architecture: Artificial minds can have cognitive architectures that are different from those of human minds.
5. Sentience: Artificial minds might not be sentient or have conscious experiences, even if they exhibit human-like behavior or possess the behavioral dispositions normally indicative of personhood.","Artificial minds may differ from human minds in their substrate, subjective time, reproduction speed, cognitive architecture, and possible lack or presence of sentience.",,,,
What ethical concerns arise from whole brain emulation?,"['relevant insofar as it makes a diﬀerence to sentience or functionality. But holding these\nthings constant, it makes no moral diﬀerence whether a being is made of silicon or car-\nbon, or whether its brain uses semi-conductors or neurotransmitters.\nAn additional principle that can be proposed is that the fact that AI systems are\nartificial—i.e., the product of deliberate design—is not fundamentally relevant to their\nmoral status. We could formulate this as follows:', '• The local, specific behavior of the AI may not be predictable apart from its safety,\neven if the programmers do everything right;\n• Verifying the safety of the system becomes a greater challenge because we must\nverify what the system is trying to do, rather than being able to verify the system’s\nsafe behavior in all operating contexts;\n• Ethical cognition itself must be taken as a subject matter of engineering.\n3. Machines with Moral Status', 'The Ethics of Artificial Intelligence\nSandberg, Anders. 1999. “The Physics of Information Processing Superobjects: Daily Life Among the\nJupiter Brains.” Journal of Evolution and Technology 5. http://www.jetpress.org/volume5/\nBrains2.pdf.\nVinge, Vernor. 1993. “The Coming Technological Singularity: How to Survive in the Post-Human Era.”\nIn Vision-21: Interdisciplinary Science and Engineering in the Era of Cyberspace,11–22. NASA Con-', 'Nick Bostrom, Eliezer Yudkowsky\ndesign is very, very safe.” This may seem like an unenviable position from the perspective\nof public relations, but it’s hard to see what other guarantee of ethical behavior would\nbe possible for a general intelligence operating on unforeseen problems, across domains,\nwith preferences over distant consequences. Inspecting the cognitive design might verify\nthat the mind was, indeed, searching for solutions that we would classify as ethical; but', 'duties to their artificial mind which they do not have to another artificial mind, even if\nthe minds in question are qualitatively similar and have the same moral status.\nIf the principles of non-discrimination with regard to substrate and ontogeny are\naccepted, then many questions about how we ought to treat artificial minds can be an-\nswered by applying the same moral principles that we use to determine our duties in\n8']","The given context does not explicitly mention ""whole brain emulation."" However, it discusses the ethics of artificial intelligence and moral status of AI systems. The context implies that ethical concerns arise from the creation and treatment of artificial minds, including:

1. Verifying the safety of the system, as its behavior may not be predictable.
2. Ensuring that the system's cognitive design aligns with ethical principles.
3. Determining duties and moral obligations towards artificial minds, similar to those towards human minds.

These concerns are relevant to the development and treatment of artificial intelligence, but the context does not specifically address ""whole brain emulation.""","Whole brain emulation raises ethical concerns about sentience, personal identity, copying minds, subjective time, and the moral status of uploaded minds.",,,,
