user_input,retrieved_contexts,response,reference,faithfulness,answer_relevancy,context_precision,context_recall
What is Artificial General Intelligence?,"['McDermott, Drew. 1976. “Artificial Intelligence Meets Natural Stupidity.”SIGART Newsletter(57): 4–9.\ndoi:10.1145/1045339.1045340.\nOmohundro, Stephen M. 2008. “The Basic AI Drives.” InArtificial General Intelligence 2008: Proceedings\nof the First AGI Conference,edited by Pei Wang, Ben Goertzel, and Stan Franklin, 483–492. Frontiers\nin Artificial Intelligence and Applications 171. Amsterdam: IOS.\n19', 'Series. New York: Oxford University Press.\nGoertzel, Ben, and Cassio Pennachin, eds. 2007. Artificial General Intelligence. Cognitive Technologies.\nBerlin: Springer. doi:10.1007/978-3-540-68677-4 .\nGood, Irving John. 1965. “Speculations Concerning the First Ultraintelligent Machine.” InAdvances in\nComputers, edited by Franz L. Alt and Morris Rubinoﬀ, 31–88. Vol. 6. New York: Academic Press.\ndoi:10.1016/S0065-2458(08)60418-0.', 'not appear in a journal of machine learning considering how an algorithm scales up to\nmore computers. This list of criteria is by no means exhaustive, but it serves as a small\nsample of what an increasingly computerized society should be thinking about.\n2. Artificial General Intelligence\nThere is nearly universal agreement among modern AI professionals that Artificial In-\ntelligence falls short of human capabilities in some critical sense, even though AI algo-', 'The Ethics of Artificial Intelligence\nimprovement. For example, the Bayesian branch of AI, inspired by coherent mathemat-\nical systems such as probability theory and expected utility maximization, seems more\namenable to the predictable self-modification problem than evolutionary programming\nand genetic algorithms. This is a controversial statement, but it illustrates the point\nthat if we are thinking about the challenge of superintelligence down the road, this can', 'indeed be turned into directional advice for present AI research.\nYet even supposing that we can specify an AI’s goal system to be persistent under\nself-modification and self-improvement, this only begins to touch on the core ethical\nproblems of creating superintelligence. Humans, the first general intelligences to ex-\nist on Earth, have used that intelligence to substantially reshape the globe—carving\nmountains, taming rivers, building skyscrapers, farming deserts, producing unintended']","According to the context, Artificial General Intelligence refers to a level of Artificial Intelligence that is comparable to human capabilities, which current AI algorithms have not yet achieved. It implies a level of intelligence that can perform any intellectual task that a human can, and is considered a significant improvement over current narrow AI capabilities.","Artificial General Intelligence refers to AI with generality, unlike current AI systems that perform only in restricted domains.",,,0.94999999997625,1.0
What is superintelligence?,"['proved, house catches fire, person-agent mistreated) but on a global or cosmic scale (e.g.,\nhumanity is extinguished and replaced by nothing we would regard as worthwhile). Or,\nif superintelligence can be shaped to be beneficial, then, depending on its technological\ncapabilities, it might make short work of many present-day problems that have proven\ndiﬃcult to our human-level intelligence.\nSuperintelligence is one of several “existential risks” as defined by Bostrom (2002): a', 'text is relevant to the application of ethics—and suggesting that this point is especially\npertinent when one is considering the ethics of minds with exotic properties.\n5. Superintelligence\nGood (1965) set forth the classic hypothesis concerning superintelligence: that an AI\nsuﬃciently intelligent to understand its own design could redesign itself or create a suc-\ncessor system, more intelligent, which could then redesign itself yet again to become', 'risk “where an adverse outcome would either annihilate Earth-originating intelligent life\nor permanently and drastically curtail its potential.” Conversely, a positive outcome for\nsuperintelligence could preserve Earth-originating intelligent life and fulfill its potential.\nIt is important to emphasize that smarter minds pose great potential benefits as well as\nrisks.\nAttempts to reason about global catastrophic risks may be susceptible to a number', 'indeed be turned into directional advice for present AI research.\nYet even supposing that we can specify an AI’s goal system to be persistent under\nself-modification and self-improvement, this only begins to touch on the core ethical\nproblems of creating superintelligence. Humans, the first general intelligences to ex-\nist on Earth, have used that intelligence to substantially reshape the globe—carving\nmountains, taming rivers, building skyscrapers, farming deserts, producing unintended', 'Series. New York: Oxford University Press.\nGoertzel, Ben, and Cassio Pennachin, eds. 2007. Artificial General Intelligence. Cognitive Technologies.\nBerlin: Springer. doi:10.1007/978-3-540-68677-4 .\nGood, Irving John. 1965. “Speculations Concerning the First Ultraintelligent Machine.” InAdvances in\nComputers, edited by Franz L. Alt and Morris Rubinoﬀ, 31–88. Vol. 6. New York: Academic Press.\ndoi:10.1016/S0065-2458(08)60418-0.']","According to the context, superintelligence refers to an AI that is sufficiently intelligent to understand its own design and can redesign itself or create a successor system that is even more intelligent. This is based on the classic hypothesis set forth by Good (1965).","Superintelligence refers to an AI more intelligent than humans, potentially able to improve itself or create more intelligent successor systems.",,0.7846260110608333,0.999999999975,1.0
What are minds with exotic properties?,"['Other properties of possible artificial minds would be exotic in a more superficial sense;\ne.g., by diverging in some unproblematically quantitative dimension from the kinds of\nmind with which we are familiar. But such superficially exotic properties may also pose\n11', 'ical questions which the aforementioned principles leave unanswered. Novel ethical\nquestions arise because artificial minds can have very diﬀerent properties from ordinary\nhuman or animal minds. We must consider how these novel properties would aﬀect the\nmoral status of artificial minds and what it would mean to respect the moral status of\nsuch exotic minds.\n4. Minds with Exotic Properties\nIn the case of human beings, we do not normally hesitate to ascribe sentience and con-', 'text is relevant to the application of ethics—and suggesting that this point is especially\npertinent when one is considering the ethics of minds with exotic properties.\n5. Superintelligence\nGood (1965) set forth the classic hypothesis concerning superintelligence: that an AI\nsuﬃciently intelligent to understand its own design could redesign itself or create a suc-\ncessor system, more intelligent, which could then redesign itself yet again to become', 'scious experience to any individual who exhibits the normal kinds of human behavior.\nFew believe there to be other people who act perfectly normally but lack consciousness.\nHowever, other human beings do not merely behave in person-like ways similar to our-\nselves; they also have brains and cognitive architectures that are constituted much like\nour own. An artificial intellect, by contrast, might be constituted quite diﬀerently from', 'Nick Bostrom, Eliezer Yudkowsky\nmore familiar contexts. Insofar as moral duties stem from moral status considerations,\nwe ought to treat an artificial mind in just the same way as we ought to treat a qualita-\ntively identical natural human mind in a similar situation. This simplifies the problem\nof developing an ethics for the treatment of artificial minds.\nEven if we accept this stance, however, we must confront a number of novel eth-']","Minds with exotic properties refer to artificial minds that can have very different properties from ordinary human or animal minds, diverging in some quantitative dimension and posing novel ethical questions.","Minds with exotic properties are artificial minds that may differ from human minds in sentience, subjective time, reproduction, or cognitive structure.",,,0.999999999975,1.0
What is whole brain emulation?,"['other animal intellect to be transferred from its original implementation in an organic\nbrain onto a digital computer. One scenario goes like this: First, a very high-resolution\nscan is performed of some particular brain, possibly destroying the original in the pro-\ncess. For example, the brain might be vitrified and dissected into thin slices, which can\nthen be scanned using some form of high-throughput microscopy combined with auto-', 'natively, it could be given control of a robotic body, enabling it to interact directly with\nexternal physical reality.\nA number of questions arise in the context of such a scenario: How plausible is it that\nthis procedure will one day become technologically feasible? If the procedure worked\nand produced a computer program exhibiting roughly the same personality, the same\nmemories, and the same thinking patterns as the original brain, would this program be', 'type of element, such as diﬀerent kinds of neuron and synaptic junction. Third, the\ncomputational structure and the associated algorithmic behavior of its components are\nimplemented in some powerful computer. If the uploading process has been successful,\nthe computer program should now replicate the essential functional characteristics of\nthe original brain. The resulting upload may inhabit a simulated virtual reality, or, alter-', 'mated image recognition. We may imagine this scan to be detailed enough to capture\nall the neurons, their synaptic interconnections, and other features that are functionally\nrelevant to the original brain’s operation. Second, this three-dimensional map of the\ncomponents of the brain and their interconnections is combined with a library of ad-\nvanced neuroscientific theory which specifies the computational properties of each basic', 'The Ethics of Artificial Intelligence\nAnother exotic property, one which is certainly metaphysically and physically possible\nfor an artificial intelligence, is for its subjective rate of time to deviate drastically from\nthe rate that is characteristic of a biological human brain. The concept of subjective\nrate of time is best explained by first introducing the idea of whole brain emulation, or\n“uploading.”\n“Uploading” refers to a hypothetical future technology that would enable a human or']","Whole brain emulation, also referred to as ""uploading"", is a hypothetical future technology that would enable a human or other animal's intellect to be transferred from its original implementation in an organic brain onto a digital computer.",Whole brain emulation or uploading is a hypothetical process of transferring a human or animal intellect from an organic brain to a digital computer.,,,0.8041666666465626,1.0
What is subjective rate of time?,"['mental notion:\nPrinciple of Subjective Rate of Time\nIn cases where the duration of an experience is of basic normative significance,\nit is the experience’s subjective duration that counts.\nSo far we have discussed two possibilities (non-sentient sapience and variable subjective\nrate of time) which are exotic in the relatively profound sense of being metaphysically\nproblematic as well as lacking clear instances or parallels in the contemporary world.', 'it spend less subjective time thinking each of a greater number of distinct thoughts.\nThe variability of the subjective rate of time is an exotic property of artificial minds\nthat raises novel ethical issues. For example, in cases where the duration of an experience\nis ethically relevant, should duration be measured in objective or subjective time? If an\nupload has committed a crime and is sentenced to four years in prison, should this be', 'subjective time is not significantly variable, it is unsurprising that this kind of question is\nnot straightforwardly settled by familiar ethical norms, even if these norms are extended\nto artificial intellects by means of non-discrimination principles (such as those proposed\nin the previous section).\nTo illustrate the kind of ethical claim that might be relevant here, we formulate (but\ndo not argue for) a principle privileging subjective time as the normatively more funda-\nmental notion:', 'Nick Bostrom, Eliezer Yudkowsky\nwhile the upload finishes reading the morning newspaper and sends oﬀ a few emails.\nOne second of objective time corresponds to 17 minutes of subjective time. Objective\nand subjective duration can thus diverge.\nSubjective time is not the same as a subject’s estimate or perception of how fast time\nflows. Human beings are often mistaken about the flow of time. We may believe that\nit is one o’clock when it is in fact a quarter past two; or a stimulant drug might cause', 'The Ethics of Artificial Intelligence\nAnother exotic property, one which is certainly metaphysically and physically possible\nfor an artificial intelligence, is for its subjective rate of time to deviate drastically from\nthe rate that is characteristic of a biological human brain. The concept of subjective\nrate of time is best explained by first introducing the idea of whole brain emulation, or\n“uploading.”\n“Uploading” refers to a hypothetical future technology that would enable a human or']","According to the context, the subjective rate of time refers to the rate at which time is experienced by an individual or entity, which can differ from the objective rate of time. It is the duration of an experience as perceived by the individual, rather than the actual time that has passed.",Subjective rate of time refers to how quickly an artificial mind experiences time compared to objective external time.,,0.8623177274690098,0.99999999998,
What is recursive self-improvement?,"['even more intelligent, and so on in a positive feedback cycle. Good called this the “in-\ntelligence explosion.” Recursive scenarios are not limited to AI: humans with intelligence\naugmented through a brain-computer interface might turn their minds to designing the\nnext generation of brain-computer interfaces. (If you had a machine that increased your\nIQ, it would be bound to occur to you, once you became smart enough, to try to design\na more powerful version of the machine.)', 'more likely than others to eventually prove conducive to the creation of intelligent self-\nmodifying agents whose goals remain predictable even after multiple iterations of self-\n15', 'a book on the future of machine intelligence and its strategic implications.\nEliezer Yudkowsky is a Research Fellow at the Singularity Institute for Artificial In-\ntelligence where he works full-time on the foreseeable design issues of goal architectures\nin self-improving AI. His current work centers on modifying classical decision theory\nto coherently describe self-modification. He is also known for his popular writing on\nissues of human rationality and cognitive biases.\n8. Further Readings', 'The Ethics of Artificial Intelligence\nimprovement. For example, the Bayesian branch of AI, inspired by coherent mathemat-\nical systems such as probability theory and expected utility maximization, seems more\namenable to the predictable self-modification problem than evolutionary programming\nand genetic algorithms. This is a controversial statement, but it illustrates the point\nthat if we are thinking about the challenge of superintelligence down the road, this can', 'current version of Gandhi does not want to kill. More generally, it seems likely that\nmost self-modifying minds will naturally have stable utility functions, which implies\nthat an initial choice of mind design can have lasting eﬀects (Omohundro 2008).\nAt this point in the development of AI science, is there any way we can trans-\nlate the task of finding a design for “good” AIs into a modern research direction? It\nmay seem premature to speculate, but one does suspect that some AI paradigms are']","Recursive self-improvement refers to a process where an intelligent agent, such as a machine or a human with augmented intelligence, improves itself, and then uses that improved intelligence to design an even better version of itself, creating a positive feedback cycle. This cycle continues with each iteration, leading to exponential growth in intelligence. Examples include a machine that increases IQ, which then leads to the design of a more powerful version of the machine, or humans with brain-computer interfaces designing the next generation of interfaces.","Recursive self-improvement is the process where an AI improves its own design or creates a more intelligent successor, leading to further improvements.",,0.8184333159554081,0.99999999995,
What is intelligence explosion?,"['even more intelligent, and so on in a positive feedback cycle. Good called this the “in-\ntelligence explosion.” Recursive scenarios are not limited to AI: humans with intelligence\naugmented through a brain-computer interface might turn their minds to designing the\nnext generation of brain-computer interfaces. (If you had a machine that increased your\nIQ, it would be bound to occur to you, once you became smart enough, to try to design\na more powerful version of the machine.)', 'risk “where an adverse outcome would either annihilate Earth-originating intelligent life\nor permanently and drastically curtail its potential.” Conversely, a positive outcome for\nsuperintelligence could preserve Earth-originating intelligent life and fulfill its potential.\nIt is important to emphasize that smarter minds pose great potential benefits as well as\nrisks.\nAttempts to reason about global catastrophic risks may be susceptible to a number', 'McDermott, Drew. 1976. “Artificial Intelligence Meets Natural Stupidity.”SIGART Newsletter(57): 4–9.\ndoi:10.1145/1045339.1045340.\nOmohundro, Stephen M. 2008. “The Basic AI Drives.” InArtificial General Intelligence 2008: Proceedings\nof the First AGI Conference,edited by Pei Wang, Ben Goertzel, and Stan Franklin, 483–492. Frontiers\nin Artificial Intelligence and Applications 171. Amsterdam: IOS.\n19', 'indeed be turned into directional advice for present AI research.\nYet even supposing that we can specify an AI’s goal system to be persistent under\nself-modification and self-improvement, this only begins to touch on the core ethical\nproblems of creating superintelligence. Humans, the first general intelligences to ex-\nist on Earth, have used that intelligence to substantially reshape the globe—carving\nmountains, taming rivers, building skyscrapers, farming deserts, producing unintended', 'The Ethics of Artificial Intelligence\nSandberg, Anders. 1999. “The Physics of Information Processing Superobjects: Daily Life Among the\nJupiter Brains.” Journal of Evolution and Technology 5. http://www.jetpress.org/volume5/\nBrains2.pdf.\nVinge, Vernor. 1993. “The Coming Technological Singularity: How to Survive in the Post-Human Era.”\nIn Vision-21: Interdisciplinary Science and Engineering in the Era of Cyberspace,11–22. NASA Con-']","According to the context, the ""intelligence explosion"" is a term coined by Good, referring to a positive feedback cycle where an increase in intelligence leads to further increases in intelligence, and so on. This can occur in recursive scenarios, such as AI improving itself or humans using brain-computer interfaces to augment their intelligence, leading to even more intelligent versions of themselves.",Intelligence explosion is the positive feedback cycle where an AI repeatedly improves itself and becomes increasingly intelligent.,,,0.9999999999,
What is machine ethics?,"['in ethics comes along, and it comes as a surprise; but most randomly generated ethical\nchanges would strike us as folly or gibberish.\nThis presents us with perhaps the ultimate challenge of machine ethics: How do\nyou build an AI which, when it executes, becomes more ethical than you? This is not\nlike asking our own philosophers to produce superethics, any more than Deep Blue was\n16', '3. Machines with Moral Status\nA diﬀerent set of ethical issues arises when we contemplate the possibility that some\nfuture AI systems might be candidates for having moral status. Our dealings with beings\npossessed of moral status are not exclusively a matter of instrumental rationality: we also\nhave moral reasons to treat them in certain ways, and to refrain from treating them in\ncertain other ways. Francis Kamm has proposed the following definition of moral status,', 'ference Publication 10129. NASA Lewis Research Center.http://ntrs.nasa.gov/archive/\nnasa/casi.ntrs.nasa.gov/19940022855_1994022855.pdf.\nWallach, Wendell, and Colin Allen. 2009.Moral Machines: Teaching Robots Right from Wrong.New York:\nOxford University Press. doi:10.1093/acprof:oso/9780195374049.001.0001.\nWarren, Mary Anne. 1997.Moral Status: Obligations to Persons and Other Living Things.Issues in Biomedi-\ncal Ethics. New York: Oxford University Press. doi:10.1093/acprof:oso/9780198250401.001.', 'MIRI\nMACHINE INTELLIGENCE\nRESEARCH INSTITUTE\nThe Ethics of Artificial Intelligence\nNick Bostrom\nFuture of Humanity Institute\nEliezer Yudkowsky\nMachine Intelligence Research Institute\nAbstract\nThe possibility of creating thinking machines raises a host of ethical issues. These ques-\ntions relate both to ensuring that such machines do not harm humans and other morally\nrelevant beings, and to the moral status of the machines themselves. The first section', 'meet. If machines are to be placed in a position of being stronger, faster, more trusted,\nor smarter than humans, then the discipline of machine ethics must commit itself to\nseeking human-superior (not just human-equivalent) niceness.\n6. Conclusion\nAlthough current AI oﬀers us few ethical issues that are not already present in the design\nof cars or power plants, the approach of AI algorithms toward more humanlike thought']","The context does not provide a direct definition of ""machine ethics."" However, it can be inferred that machine ethics refers to the discipline or field of study that focuses on ensuring that artificial intelligence (AI) systems behave in a morally responsible and ethical manner, particularly as they become more advanced and potentially surpass human capabilities.","Machine ethics concerns how AI systems should behave safely and ethically, especially as they take on social or general intelligence roles.",,0.8214870723554569,0.6999999999766667,
What is the principle of substrate non-discrimination?,"['same moral status.\nOne can argue for this principle on grounds that rejecting it would amount to embrac-\ning a position similar to racism: substrate lacks fundamental moral significance in the\nsame way and for the same reason as skin color does. The Principle of Substrate Non-\nDiscrimination does not imply that a digital computer could be conscious, or that it\ncould have the same functionality as a human being. Substratecan of course be morally', 'has sapience of a kind similar to that of a normal human adult, then it would have full\nmoral status, equivalent to that of human beings.\nOne of the ideas underlying this moral assessment can be expressed in stronger form\nas a principle of non-discrimination:\nPrinciple of Substrate Non-Discrimination\nIf two beings have the same functionality and the same conscious experience,\nand diﬀer only in the substrate of their implementation, then they have the\nsame moral status.', 'child and a normal child is grounded in the qualitative diﬀerence between the two—the\nfact that one has a mind while the other does not. Since the two children do not have\nthe same functionality and the same conscious experience, the Principle of Ontogeny\nNon-Discrimination does not apply.\nAlthough the Principle of Ontogeny Non-Discrimination asserts that a being’s on-\ntogeny has no essential bearing on its moral status, it does not deny that facts about', 'duties to their artificial mind which they do not have to another artificial mind, even if\nthe minds in question are qualitatively similar and have the same moral status.\nIf the principles of non-discrimination with regard to substrate and ontogeny are\naccepted, then many questions about how we ought to treat artificial minds can be an-\nswered by applying the same moral principles that we use to determine our duties in\n8', 'The Ethics of Artificial Intelligence\nPrinciple of Ontogeny Non-Discrimination\nIf two beings have the same functionality and the same consciousness expe-\nrience, and diﬀer only in how they came into existence, then they have the\nsame moral status.\nToday, this idea is widely accepted in the human case—although in some circles, par-\nticularly in the past, the idea that one’s moral status depends on one’s bloodline or caste']","The Principle of Substrate Non-Discrimination states: 

If two beings have the same functionality and the same conscious experience, and differ only in the substrate of their implementation, then they have the same moral status.","The principle states that if two beings have the same functionality and conscious experience, they have the same moral status regardless of whether they are made of silicon or carbon.",,0.9004534091750246,0.9166666666361111,
